İ ,1,0
"At the beginning, I would like to point out the buying advice for this game: If you are a personal fan of Dragon Knight 07, buy it! If you like the ""Sea Cat"" and ""Chilling"" series, buy! If you are interested in the plot and personality of the AVG game The demand is high, buy it! But if you can’t accept stomach medicine, scalpel, especially the kind of particularly beautiful young lady on the public screen, torturing you to the point where you don’t think about it...please...please think twice. First of all, I will give you a simple science. This game actually comes from a whole series created by Dragon Knight 07. This series is divided into the opening chapter ``Gao Hime'', the promotion of ``Song Hime'', in-depth ``Hen Hime'', and the core ``Deer God Hime'' "", and the final ""Wish Hime"". So this game is actually the last game in this entire series, and it is also the most classic, most prestigious and most popular work in this series. I don't know if ShiraVN will have plans to bring several previous titles to Steam one by one, but in terms of the operation of some previous games, it can only be said that it is not yet known. Therefore, before playing this game, if you have the opportunity, it is strongly recommended that players experience several previous games. The story of this work is closely related to the previous works. As the title says, it is a story about a millennium promised horror and moving. In the story, Ryo was saved by the gods at the cost of his life, but the black god made a wish, but there was no way to resurrect Ryo, so he had to make a wish that the love thousands of years ago could finally be perfect. Therefore, the story of a thousand years ago became a plot intertwined with reality, and finally it was perfectly condensed. Thanks to this, the coolness of a thousand years ago made a wish for a thousand years later, and I hope that the black god after a thousand years can obtain Happiness, in exchange for a summer of security for the male lead. The story of this work is actually very complicated, but the summary is also very simple, it is a reincarnation of salvation: the current man and woman saved each other thousands of years ago, and they were saved thousands of years ago, and they were able to save each other again. . It is complicated and touching here. It is the sorrow and vicissitudes of these millennia that have already reached the height of the plot. But objectively speaking, this work and even this series, all success stands here but also loses here. Such a complex plot setting is a highlight, but at the same time, due to the excessively large trend and the personal instability of Dragon Knight 07 himself in the long creative process, it has led to the same character in several works, There are also many unreasonable points in the plot trend. Moreover, the turbulence of the plot, and the structure of digging numerous pits but filling in these pits one by one, makes the plot impressive in some places, but it seems a little broken in some places. From this point of view, if you just look at the excellent work, and you only have a general understanding of the plot of the whole work before playing this work, you may be able to get the best experience. But if you have played a few previous titles, especially ""Guahime"" and ""Gehime"" (Dragon Knight 07's writing skills were still a bit immature at the time), you will inevitably have a lot of complaints about the whole plot. Apart from the above problems, in fact, this work can really be said to be a particularly outstanding work. This game has obvious characteristics of Dragon Knight 07 in the theme of Japanese style. The whole story is very long and the weight and quality are guaranteed. And the whole process does not bring those complicated branch options, so the brain is not tired, the plot The single part is delicate enough and the ending part is well-closed, and the whole age does not have H or is excessively bloody. So if you are tired of playing ""Sea Cat"" or ""Chilling"" series players can experience many, many different wonderful experiences in this game. On the other hand, the quality of this work is always guaranteed, because the price is really affordable, and the beautiful and beautiful OST and dubbing alone are enough, plus this series is late, so the picture is naturally more delicate and refined. . Dragon Knight 07 has tried commercial transformation before, but it is said that the final cooperation failed, indicating that he is really not suitable for a path similar to FGO. On the contrary, the unforgettable plot and personality of this work proves it. It is his fertile soil to practice art, literature, and write a good plot and story structure. Having said so much, in fact, in one sentence, even though the whole series of problems make this work have many flaws, but this game is undoubtedly a masterpiece of excellent content and quality. ",1,0
Make a fall sale task ,1,0
"There are always chetos, the best online game for cheaters in the world ",1,0
"A game worthy of its time. It has become obsolete now, but sometimes you can go in and remember what this great series was then ",1,0
"If you like lego-style games, it is a nice game that you will like. I recommend it for those who will play in their spare time. I especially liked the variety of characters, features and vehicles. ",1,0
"ok, yeah, you enter the game, what not and the error is fucking you? and so you go to this link: download all the files, shove it to some folder, download it all to gothic, then a few goths and enter the game, then you will get in the murder but give him back if you can, because this type of rubbish then you go, take a pickaxe and fuck this mole and you go to some hut there, then you enter the house, you go to sleep and it's so fucking farther than he goes by himself, not a grateful fucking ",1,0
"9.99 might be a bit steep, but it's a good game.  Thoughtful, deep.  The closest thing we'll ever get to an Earthsea game.   Touches some pretty heavy topics, but not too heavy handedly.  A lot of love and thought went into this. ",1,0
"Factory, the shop is full of old Soviet machine tools. Ivanitch is walking through the shop, and suddenly a blank flies into his head. He immediately falls. Petrovich runs up to Ivanitch and asks, showing his hand: - Mason, how are you? What do these numbers mean, Mason? - What are the numbers? - Where is the station that transmits them? - What are you talking about? - Numbers, Mason, numbers, what do they mean? Where are they passed from? - I don't know anything about what numbers! - What happened in the Bay of Pigs? - We hunted Castro, we were led ... ",1,0
"A game where you just glide through an automatically generated map The best part is how to make a thrilling gliding by getting a high score by flying on a narrow terrain. It's a simple game, but it's highly immersive and inexpensive, so if you're interested, please try it. In that case, it is recommended as it is, but I definitely want you to play with your favorite BGM. By doing so, it becomes the best sound game at once. If you can play in sync with the wind noise and your favorite music in a free sky with no course or enemies, your brain juice will be dripping. The game itself is very light, so it's good to let the pot cast run down, or create your own playlist. One song I personally recommend is Fatboy Slim's Sunset Bird of Prey. Here's an unlikely game where you can fly freely in the sky with music. ",1,0
"Pros: -Great gunplay (my favorite being the auto-shotgun). All guns sound nice and feel nice to shoot. -A variety of challenges to complete for in game currency. -Game is very humorous (albiet really ♥♥♥♥♥♥♥ wierd). -VR support. -Massive arsenal to collect. -6 Wave based maps. -Enemy dismemberment is great (save for the sound the enemies make when you do). -Dual wielding for almost all weapons. -Weapons can spawn in as better variants of the original gun (Such as being suppressed, scoped, etc). Cons:  -Only melee weapon in the game (the meat tenderizer) feels odd and feels like it's weightless. -Music is hit or miss. Some tracks are good, others sound generic, and others just bad. -No health meter (The blood effect around the screen is utilized) along with no ammo counter for each gun. -Batteries to respawn weapons when you run of guns respawn infrequently. This results in going around in circles for a while to find one out of four of the necessary batteries to spawn something. -Enemy diversity is only on the surface level (they only look different and have no uniqe abilities). The cons really aren't that bad, as the game is still a blast to play. If killing sausages in your backyard with an uzi whilst sipping wine and listening to some funky fresh beats sounds fun, then buy this game now. This game deserves your attention. ",1,0
Warning: Can only detect less than 5000 characters,1,0
"It's a very relaxing game, I really love it. You have to take your time and rushing it, is a bad idea.  It's not a fast phased game. This game is really for a gamer that loves exploring, harmony and open-worlds. ",1,0
best game drawing camune good survival norms ,1,0
100/100 BEST GAME EVER ,1,0
+ rep ,1,0
This is just a free game. I am not Oki-Doki after playing Doki-Doki ... ,1,0
"Tremendous game, good, realistic gameplay, good weapons and excellent setting ",1,0
MINECRAFT SIDEWAYS WITH MODS haha. GOOD GAME THO. SHOULD BE MORE SEX SCENES THO ,1,0
i like it but i dont like when modders are just ♥♥♥♥♥♥♥ with you. but i like modders who are nice. we need more nice modders instead of the mean ones. ,1,0
why not ,1,0
"I like, good game <3 ",1,0
"Until today, I had to plow the wastelands of this game only once, at the beginning of the 2000s, so my choice was not dictated by fan urges, although there are nostalgic notes. However, nostalgia is easily destroyed, because the test of time has not been canceled. Time is a merciless thing. In order to gain immortality, you need to be a truly outstanding project, art with a capital letter, which is what it is. It is usually said that success is in simplicity; here it is exactly the opposite. The brainchild turns out to be an extremely difficult project in terms of implementation, because ... This applies to the main storyline, various secondary events, the gameplay itself and a great many little things. So that you understand the scale, now they do this: - unless with their own series - where everything is limited only by our imagination, and the developers themselves did not provide for some possibilities. The world of the game is strikingly different from the contemporaries of the series. Yes, this is still the same scorched post-apocalyptic wasteland, but the degree of cruelty and adulthood in general is elevated here to an absolute. If it were a thermometer, it would certainly explode. Before your eyes, the whole family will turn into minced meat under the fire of miniguns. The ""hero"" himself may turn out to be a b *** com without moral principles, who easily deals with children, there is even a feature that is permanently attached to the hero:. Playing a female character, you can act out, which can solve many of her problems through bed, and if this is not enough, you can become - this is by the way a perk, i.e. the usual ability that is given every 3 (4) level ... In addition, if the game was released today, the LGBT community would be in a pleasant shock, because everything that is required is present in the game, the main thing is not to delve deeply into the materiel, so that awkward questions in the spirit do not arise : Ahem. Although the combat system may seem clumsy, besides, there are no fashionable shelters nowadays, however, there are, for example, critical blunders that negatively affect the one who actually missed: misfires, various injuries, falls, etc. It comes down to the comical - a lot depends on the points invested in ""Luck"". In addition, do not forget that the local, turn-based combat is equipped with a system of aiming at various parts of the body, which means that you can hit the ""balls"" with a particularly sticky pepper, or finally check if the Super Mutants have something there ... Character creation here is a very important, very intimate step that needs to be approached very thoughtfully. Moreover, I will not say hackneyed: (a set of skills, statistics). : - since in these vast expanses, your character's success depends on a set of skills and statistics. Even an ardent loser with one (out of 10) luck has a right to exist, moreover, it has a number of its advantages, but it is you who must decide and understand that your hero will be a loser in life. And who said that the main character's failure should not be passed on to others as well? Or maybe you want to play as a complete slow-witted? Always playing a thief? Well, here you can fully get used to the skin of it, because Everyone has pockets and anything can be found in them, besides, experience points are awarded for a successful theft. Class! The threshold of entry is quite biting, which is facilitated by the interface, partly game mechanics and not the most expressive beginning. However, it is worth getting used to, leaving a little later, where the eyes are looking and opens before the player, the implementation of which by the player often will not remain without consequences. Did you want to try yourself in the slave trade? You are welcome! But know that you are branded with a seal on your forehead. Have you decided to destroy one of the most dangerous bandits? His embittered brothers have already advanced behind you. Is the nimble prankster who still has milk on his lips robbing a gaping hero is not the first time? - for no apparent reason, a naturally detonated child sprinkled the unreliable quarter with his entrails. The most interesting thing is that in the local open spaces there is no clear division into typical components: research, battle, completing tasks. The line here is extremely blurred and any microscopic event can result in anything, for example, promiscuous sexual intercourse can lead you to the altar at gunpoint ... ",1,0
After hundreds of hours on console here is my in-depth review. Pros: Loki Cons: Loki Thank you for taking the time to read my review. ,1,0
"don't worry about this, i'm just doing this because steam asked for ;) ",1,0
Such a relaxing game to play on a rainy day <3 ,1,0
Hard to top ,1,0
This is the game that gave me my love for planes. ,1,0
to ,1,0
B i g l a g b i g d i e ,1,0
"its a really good game, cuz you can have skins , fun teammates, and i recommend buying Prime ",1,0
good game. sorry there is no regional price for dls ,1,0
"The game is fun, but the mode is not fun. It only speaks English, but if you press it according to your intuition, the game progresses. ",1,0
cool I guess.. ,1,0
Good ,1,0
"special stages suck but other than that, pretty good game ",1,0
"Plot \ Career ☑ It will replace your life (seriously) ☐ Memorable ☐ Interesting ☐ Not boring ☐ Better go to sleep ☐ Plot? Graphics ☐ Reality looks worse ☐ Juicy ☐ Good ☑ Acceptable (not a BOMB!) ☐ Bad ☐ Is there something in there? ☐ Dangerous for the eyes Gameplay ☑ You can do this forever ☐ Interesting ☐ Simple gameplay ☐ Well this ☐ It's better to just sit still е It looks like the developers have forgotten what they were doing Audio ☑ Ecstasy ☐ Very good ☐ Good ☐ Will do ☐ Your voice sounds better ☐ Play without Sound Speaker WHAT IS HAPPENING HERE ?! ☐ Very dynamic ☐ Intense ☑ Moderate ☐ Calm ☐ Can even fall asleep ☐ Maybe she just hung up? Difficulty ☐ Sell your soul to Satan ☑ It will be a hard road ☐ Just learning / becoming a master is hard ☐ Medium ☐ Sometimes you need to play with two hands ☐ Press ""X"" to win Audience ☐ Newborn ☐ Children ☑ Adults ☐ People ☐ Definitely NOT people PC requirements ☐ Wait for a quantum computer ☐ Powerful ☐ Normal ☐ The first computer will go ☐ The calculator will do ☑ It will start even if you just plug in the electricity Pumping ☑ You can't do it in one life ☐ An overabundance of grind ☐ Sometimes you get bored ☐ It's just a gameplay ☐ Only if you want to become a show-off ☐ There is nothing to pump. Game time ☑ Infinity is not the limit! ☐ Quite long ☐ Medium ☐ Short ☐ You won't have time to blink Price ☐ You have nowhere to put your money? ☐ Not worth spending ☐ You can wait for a discount ☐ The price meets expectations ☑ Priceless! Bugs ☐ CAUTION! RESERVE! ☐ Can be annoying ☐ Sometimes they come across ☐ Have you seen them? ☑ There is simply nothing to bug ",1,0
Buenardo ,1,0
Class ,1,1
probably the best game on steam tbh ,1,0
You have to overtake the deer on skis You will feel like a real athlete ~ A little reminiscent of the Russian winter ww ,1,0
"I got this product for free on the incentive. I bought the game in the gazebo, tied the account to the stim and gave it. Overall, I liked the game. Well, I'm not going to praise either, because there are enough shortcomings. ADVANTAGES. The game is very similar to Fallout 4 (only Fallout 76 is worse). More than any different weapons and modifications for weapons and armor. Pleased with the dialogues. They are not so monotonous and I liked the factor that again appeared in the dialogues ""Strength, endurance, charisma, intelligence"" (well, I think you understand who played NV and part 3). Well, I didn't remember the tasks themselves, which means they were boring and typical (but there are a couple of interesting ones). The community is friendly. I've met some bugs and won't say that they are so critical. I liked the world itself (here people do not eat their bread for nothing). LIMITATIONS. Terrible optimization. What kind of optimization is there? She's not even there. There is no balance (well, I run at level 39 and I come across ghouls, super mutants and other evil spirits of level 69. Is this okay? Well, I understand if 42-45, but 69 is just a shock) Well, how can OUR GREAT AND LOVED TODD HOWARD NOT DONATE? HE IS FASTING. I apologize for the mate, but the bitch in whose stupid head came the idea of ​​introducing donat into paid games? What the fuck am I supposed to pay for a game like that and for a single company? Todd ahuel. I wouldn't be surprised if the Brotherhood of Steel update is paid. TOTAL. You can play, but not so addictive. Well, at least I didn't get addicted. ",1,0
"Souls in 2D. And I could stop there. Apart from the camera, probably no game is as close to From Software's production as this one. The differences are small and you can say that where the developers wanted to differentiate a bit, it was worse - like a development tree, which is huge, but the distribution of skills there is bizarre (by targeting the rogue, I wanted to develop more damage dexterity, and to use better knives, I had to raise mainly stamina). Restricting access to NPCs by figures and only a few slots per temple was annoying. And the bosses, although they look good and they differ, the fights are similar - here I was suffering from the lack of the third dimension. For example, we could add a second or third plan and jump between them, it could be interesting. ... but I won't just complain. I had almost as much fun as with the DS series. The same feeling when you defeat some more difficult enemy or finally find a place to rest. Map and various shortcuts to other places. And this climate in general. Backed up by a great soundtrack and small things like different kinds of ""estuses"" depending on where we got them from. The game is addictive and you want to come back to it, and this is the most important thing. A must-see for Soulslike fans. ",1,0
Perfect ,1,0
"Initially, I could not imagine how it was possible to transfer this game from 2d to 3d. But fucking turns out to be possible! 8 collosis out of 10 ",1,1
"Keep your wits about you and your management skills sharp. Otherwise life will be solitary, poor, nasty, brutish, and short. ",1,0
"Clearly, blaspheme here to speak ",1,0
Awesome game ,1,1
"Cs: go is one of the most ideal games to pass after cancer. The game seems to be ahead of Cs: go in terms of realism, tactics and graphics. ",1,0
"Max Payne plays a part we never expected him to play.....The ♥♥♥♥♥♥ in a country that takes adavantage of the poor and kills off the rich. He knew so much from his experiences taking down a dark secret corporation that kills his wife and child and to being seduced by Sexy Mona ( who can pull machine guns out of her panties) lol wtf. With stories this far fetched its hard not to burst out lauging at how serious this game takes itself. But it translates so well!!! Y?! Because he is Max Bleeping Payne. This is a character that has been built up from his failiures but is too ignorant to realize it. His mind is clouded by his addiction to Rhino Whiskey and Vicodin painkillers, which makes him repeat the same mistakes he made in the previous games. He's a good guy but he beats himself up and sabotages his friendships so that he can wallow in the self pity that kept him sane and alive for 30 more years. But why sane and alive? Well Max always knew he deserved a painfully slow death for all the women he allowed to die in the previous games, Or he thought he did, but as usual with these types of people, time comes by to slap them and give them a hickie. And a product of time was his good friend Raul Passos who over time develops a bromance with Max as they work security details in Panama and Brazil (lol jk, they dont do it guys :) . Max awakens and his desire to persevere and push on another day becomes a natural instinct for him as he faces enemies from all sides threatning to kill the family he is protecting :( . ♥♥♥♥ goes baha from there and the place becomes Baghdad on G-strings. He realizes that death and transformation are all too necessary to cleanse Brazil from a evil conspiracy and uses his dissapointments as weapons. This game is brutal because of that and they do a good job of showing that desperate side of Max. When given the choice of eating fried chicken or playing max payne.........I would just do both because theyre both greasy surprises. ",1,0
Pukka. ,1,0
i cant believe i suck at a singleplayer/coop game but yea its fun and nice to play with music in the background or something idfk asdpfikvujhbasdpiufv ,1,0
Hello best game) ,1,0
"The game was literally in one breath, everything in 2 hours and it took me only 6 hours to complete the game. This is a penny in comparison with the fact that I spent much more hours in games with a closed world. By the way, all games from the Saints Row series have an open world. I really don't know what to say about the game .... Of course it is better to go through it with a friend, it will be both fun and cool and have an interesting time. The game has no intricate plot, a lot of guns, and most importantly, a lot of humor. There are only 5 sections of Hades in the game, where you will have to help all the villains from the past games in order to remove Satan from the throne together. There are also 7 secret weapons in the game, which, when pumped to the maximum, will blow up, break everyone and everything. New characters have appeared and during the game you can play as Johnny Get or Kinzi. The game takes place in Hell, so the enemies are mostly devils or souls of dead people. This game is worth playing for the sake of trash, guns, Satan and unforgettable sensations, by the way, there is no God in this game))))) ",1,0
A funny little game! Worth the Money :D ,1,0
"Awesome fast paced game, gets you in the zone pretty quick. Awesome choice for new vr players, easy controls and an amazing workout. ",1,0
I've gotta say this was one of the funniest game that I played in 4 player coop. We constantly laughed. Really 10/10 experience. ,1,0
epic ,1,0
"Great Action FPS Open World RPG game! Borderlands 2 is one of my favorite games and got me very hooked. With a story that contains jokes (Some are funny) You can customize the character as you want. There will be 4 characters to choose from, if 2 more DLC will be added, each of which has a different gameplay perspective, fast, easy-to-understand gameplay and not too poor, even if the AI ​​is not very smart, but if it's smart. I think this game is going to be very difficult because I see each parade in the army -..- Importantly, you can co-op with up to 4 friends!!! There is a lot to do in this game. With an open world where you can find guns, level up, do sub-quests to get more items. Good things are not so difficult to find. Even though playing alone is a little boring. Other advantages - The music matches the situation well. - This game is falling from a high place, it doesn't hurt hahahahahahahahahahahahahahahahahahahahahahaha Plus enticing It is another charm. If you've never played FPS games before, try Borderlands 2.If you really like leveling up, you'll be sucked into this game and don't have time to do anything else. (Bundle) ",1,0
"""BEST SHOOTER OF 2016"" :v ",1,0
good game ,1,0
So you can complain less. ,1,1
Was okay at launch but devs missed a lot of stuff tha was promised. Two years later and the game is so much more. Lots of fun tbh ,1,0
Very well optimized. Runs on low-end pc's. ,1,0
soup ,1,0
"Yes, the best game EVER! <3 ",1,0
"While some of the mechanics in Kingdom come deliverance are not my favorite (picking lock was just a tedious mini game for example) the story, and history more then make up for it. ",1,0
Game full of russian people ,1,0
DodoRex ,1,0
MY PLEDGE IS TO SACRIFICE MY OWN LIFE FOR BAYEK OF SIWA. ,1,0
