İ ,1,0
"I was lucky enough to have played this game before the launch of the steam version. I would like to point out the fact that many features were removed, such as being able to take off in your airplane and being able to pilot a boat unless the $7.99 subsciprtion fee was paid in full... I realize now, its all about the money, and that WW2 Online is dead.  Do yourself a favor and download ""Heroes and Generals™"" for the real WW2 gaming experience. ",0,1
trash game cheaters everywhere ,0,0
"The idiot game Taiwan Duan is really disgusting, but I have always liked your games. Completely disappointed. I wish your studio will die tomorrow, my game can’t be refunded, this little money can buy paper burning for your mother. ",0,0
terrible!!! boring!!! walking and running and looting (if you find any useful items) without any Real objective in a big map full of empty things. and price still too expensive for this empty!! ,0,0
"Downloaded the game for the free weekend. As soon as I opened the game, my game started freezing. When I tried to go fullscreen, it expanded past the screen limits and prevented me from changing options. Game is slow to start as well. Was not even able to get into a game before experiencing tons of issues. ",0,1
HE HAS BAD FPS; / ,0,0
With this update they screwed up. ,0,0
"Misleading if there is single player in the description and you can no longer progress alone with the first boss opponent. And because I tried 4 hours to get frustrated, I am not allowed to submit a refund anymore! This increases the frustration even more! ",0,0
"Score: 1/10 (-) Soundtrack and effects. (-) Graphics. (-) IA. (-) Effects. (-) History (?). (+) Steam trading cards. The game meets the expectations of ""surreal"" (I would say silly) in short, I am not in favor of that trend ... and if you are epileptic I would not recommend it either. Based on my tastes and / or opinions, I will say that this game is for a select and exclusive group of people ... those who like the movement of bizarre colors, repetitive music and who think they feel cool mutilating little animals in their mother's basement. If, on the other hand, you are a ""normal"" uncle (I don't know what is worse) this game will seem garbage. But go ahead and take a chance. ;) ",0,0
Shoe 1 is a game that can't go up in Nova ,0,0
(Review text hidden) ,0,0
Not revolutionary but a good old school vertical shoot-em-up with a strong multiplayer component. ,0,0
"too dark for ANYONE to see. Too easy to lose the car which makes it a pain in the ass to find it later. Also, I could hear other people in OTHER lobbies talking in their game. It was kinda stupid ",0,1
No. ,0,1
"I assume that Brazilian friends, like me, have never played Taslisman. I bought half the kick, and from what I played, I imagine it is a really cool game to play with friends. If you want to try, buy the other edition, Talisman: Digital Edition, which is the multiplayer edition that really emulates the physical game. This Prologue Edition appeals to those who are forever alone like me and looking for a card game + board + miniatures with an RPG look to play alone. You are the only player on the board; instead of AI controlled rivals, the game features quests that you must complete, like ""kill the bad guys and save the princess"". Then you roll the dice, walk around the board, take cards, win items, fight enemies etc. So far cool, right? What kills is the following: let's say you need to take five to fall into the house where the bandits are. You take six, then go straight. You roll the dice again hoping to get one (the game allows you to walk ""backwards""), but you get three, so it will stop two squares later. Roll the dice again, ""go two, go two"" ... four. And then you stay in this dance to fall into the house where you need to fall, fighting against the dice. The nail in the coffin of the game: to close the missions with maximum quotation, you have to solve everything in a maximum number of turns, but how the hell will you manage to close a mission in, say, ten turns, if it takes twenty turns to finally be able to fall in the damn house that has the quest? In short: great idea, bad execution. I understand that in this type of game we fight against the dice, but the worst thing the guys could do in a game with this characteristic was to put a limit on turns. ",0,0
6/10 ,0,0
"Don't do it, it's a trap. Right now the game is unplayable, ping on 250 NA servers, which I'm from, the game itself is a ARK DLC gone horribly wrong.  I haven't been able to ENJOY the game, because of these reasons.  I can't log in, constantly being rejected by the server, and if that's not happening the game is kicking you, if that isn't happening you are lagging and rubber banding like crazy.   The graphics look like ARK was tossed into a blender and then slapped onto a canvas.  The base ark files are found all through the program, you can even access the ARK menu from ATLAS's main menu..... like wtf, seriously?  For now,  and I understand the game is in early access. But DO NOT BUY THIS GAME AND PAY THESE PEOPLE SO YOU CAN BETA TEST THEIR CASH GRABS. ",0,1
the best hacking game !_! ,0,0
The game is great but UPLAY makes me not want to play the game each time. ,0,0
Fuck the frame. Don't add stuff. ,0,1
"TL;DR: Not suggesting ep.1-5 for 15 EURs, maybe around 6 EURs. PRO: - Nice character arcs and unfolding, good twists. - You get to play multiple characters in the story. - Intention cohesive! From the very beginning to the end, every action makes sense sooner or later. Mostly later. - A bunch of puzzles are creative. CON: - Console ported. Via Unity. So control on PC is quirky and gets point and click to the bone. Makes time limited challenges   frustrating. Cam pans and switches makes even worse. - Ep1-3 will not be amusing, and you get the Fallout feeling. - You will have some facepalms on some expectable drama points. Could bear some more polish in there. - Most of the things get place in the big picture in the end, but you will have a few oddities stay unanswered. - 15 EUR is too much for this. The thing: Played through the game at a friend, I belive that counts as free :) I like telltales, moral choices and paper novels. Ep.1-4 is... ah well, if you have a rainy day and cave-in felling, it lives up for a time killer...as it has just happened now. Ep.3-5 gets better with the twists, and so pretty interesting. In general it seems as the game got it's wind during the episodes. I very appreciate the outcome, but not to make the players pay to get on track. So as the whole ep1-5 is now available for 15EUR, I would call 6EUR as fair price. Escape Dead Island costs 15 EUR. ",0,0
"I said to myself ""super a saints row with super power, cool"" unfortunately I find that we get rid of it very quickly, too much freedom. And the weird bug effect in terms of graphics is just really gross. Fortunately there is the workshop otherwise I would have stopped playing there a long time ago. Saints Row 3 is better. ",0,0
"Great game capped at 30fps. Negative Review for Take-Two's stupidity. No mods no life, fuck you disgusting dealer. ",0,0
"I had this game in my library for over 3 years. started it the first time when it released and instantly uninstalled because of bad FPS, lags and unoptimized gameplay. 2 years later i installed it again to see if something has changed. Well not a lot. they basicly removed all zombies because they had performance issues. graphic looks nice because of a lot of bloom but its not worth it the 30FPS. Its a nice game to walk arround (basicly its just a walking simulator right now) and search for loot which you will lose because of bad despawn times. people tried to get arround the despawn times and build KIND of bases with a construction were they block entrances with tents to save their stuff. but most of the time there is always a way intro it. server admins try to counter it with ""friendly zones"". so what is this game about after 3 years? spawn. run arround and try to loot a area were already 10 people tried to find loot before you. Meet people who will shoot you in the back. If you survive this, you will probably fall of the last step of a staircase and injure yourself which will lose you all your loot. you respawn again, find 4 guns, but no ammo. you get killed by a tribe which is owning the server for the last 1.000 hours of looting. server will reset. you lost everything. all the hours in this game for nothing. dont waste your time and money.. seriously + landscape to walk arround -performance -sound (not sync) -Bugs -... actually the whole game ",0,0
Servers are dead for OCE was good not anymore RIP PUBG fornite is better ,0,0
"The content is empty and boring, not recommended ",0,0
"Time may flow like a river, but history does NOT repeat. Secret of Mana is hands down my favorite game of all time. I loved it as a child. I've played it dozens of times and play it at least once a year. I preordered this the day it was listed. If you are like me and love Secret of Mana, go play the original release. This release is a huge let down that I cannot recommend.  Gameplay is WORSE --------------------- The gameplay is a dealbreaker, even if everything else was great (spoiler, its not). The prerelease claim was the gameplay was improved, the reality is anything but. Distances, timing, and hitboxes are changed for the worse. Advanced combat techniques like dash attacks, strafing, or magic stacking, are removed. Enemy and ally AI are worse. The action grid is gone. The ring menu system is worse, you can't tell whose ring is open and there is no memory of last open ring or last selection. The combat just feels awful compared to the original, much less precise. I hate every second of it. *EDIT* As pointed out by Sniperfox47 and C4RNIVOR3, ""the currently open ring is indicated by the cursor color. Blue is The Boy, pink is The Girl, and green is The Sprite."" Still harder to identify then drawing the ring around the character, and lack of ring memory remains.  Graphics -------------------- I despise the graphics, both artistically and technically. To give a tiny bit of credit, within the restraints of the art direction some things are done well, such as the main characters and mana spirits in cut scenes. Secret of Mana was one of the most beatiful and technically impressive SNES games, only surpassed by its sequel. It deservers so much better then this. I don't oppose the move to 3D. It could have been done right. But it was not, the game has the look of a PS2 game, extremely low quality models, textures. and effects. There are so many ways this could have been amazing. They could have stayed 2D, gone with an amazing look like Ori or other high quality 2D. They could have had a toggle back to the original graphics like Wonder Boy or other games. Going to 3D they could have done the game justice, having the same level of quality today that it did when it was released. What they did was make it on the cheap, low quality, low tech artstyle. They don't even animate talking. Music and Sound ----------------------- The music is remixed. I'm not a big fan, but its good they tried. There is a toggle to switch back to the original music. Some sound effects are the same, others are changed inexplicably. Overall, music and sounds is a letdown. Story ----------------------- The original USA Secret of Mana release had some large issues. The translation was extremely rushed, and due to the information density and font differences between kanji and English huge portions of story were discarded. This remake is a great opportunity to bring a lot of this back. The game has voice acting, and thankfully they give an option between English and Japanese voice acting. The English voice acting is mediocre. They do expand the story, but its a really mixed bag. I knew I was in trouble when the opening was missing the classic ""Time flows like a river...and history repeats..."". Staying at an Inn can throw additional story cut scenes, and again these are a very mixed bag. The PC Port -------------------- Generally it's a decent port. Haven't had any major issues. Have had some framedrops and slowdown which is astonishing given the artstyle and my PC, but its a competent port. *EDIT* Have had two instances of needing to force quit, once dialog stuck looping and one animation glitch preventing combat.  Ending Words -------------------- I am glad this port exists, even if I hate it. I'm glad new people will be exposed to this classic game. I'm glad they ported it to PC with decent quality.  But I can't recommend this game, on the gameplay problems alone. The art style is atrocious and cheap. I will continue playing this game until completion. As the worlds biggest Secret of Mana fan, its like a train wreck, I have to see it through. Once its over I will go play the original as a palate cleanser. ",0,0
Bullshit ,0,0
"Disclaimer: I RECOMMEND you buy this game on sale, not full price. This game can be fun, but it's unpolished and has tons of issues.. I haven't found a proper balance- Rookie is so damn easy that you can easily drop 60+ points 10+ rebs, asts, and steals (per game),  and WIN almost every single game. The AI of your team also seems to be fairly on point. Pro is basically the same- it's slightly more difficult, but it's still really easy. Then, All-Star is more reasonable, but it's still not easy. Actually being able to steal the basketball, being able to pass it without getting a turnover, and making shots more than missing becomes a somewhat rare occurence.  Your team AI becomes worse, and the opposing team's AI improves. Superstar is more of the same, however making shots becomes even more difficult, and your team AI becomes garbage, whilst the opposing team plays top-notch. Attempting to steal the ball will most of the time lead to a reach-in foul. Turnovers become extremely prevalent in this difficulty, as it seems the opposing team intercepts 50 percent of your passes. But, although I have bashed these difficulties, it still is very possible to win, it's just most games will be a nail-biter.  Also, it will likely be not very fun, as you will miss shots way more often, get fouls way more easily, and accumulate turnovers at a ridiculous rate. But, the Hall of Fame difficulty is the real problem with this game. Shots simply don't go in for you or your team anymore; you'll be lucky to make 20 percent of your threes. Steals simply won't happen for you (be prepared to get fouled out), or your team anymore (probably for the other team though). Turnovers will make up a big part of your stats....and you simply will not have fun at this point. It's very unlikely you will win at this difficulty unless you are very skilled. You essentially have to do everything yourself, as your team becomes useless, while the opposing team excels.  The whole difficulty curve thing is just ONE issue with this game. It is so unpolished, with voice actor messups included in the game, pointless and boring cutscenes, repetitive dialogue, server issues, and an insane amount of hackers within those servers.. If you want to have fun, and you aren't that good, play rookie/pro. It's easy, but at least it's actually enjoyable. HoF is ♥♥♥♥♥♥♥♥, Superstar is stressful, and All-Star MIGHT be okay (I don't remember this one too well. I just know as the difficulty increases, it generally just becomes even less fun. I don't recall a huge difference between All-Star and Superstar). I just feel as if they release these games without even ♥♥♥♥♥♥♥ thinking. There are so many transparent issues with this game... that it's just absurd. Every aspect of this game seems to have some abnormality that ruins it in some way.  I would buy this game on sale, maybe, but definitely not for full price. The online mode is pretty bad- it's filled with hackers, and it's definitely not noob friendly( I lost most of the time). It also has a host of server issues. This game in general is unpolished, and the difficulty curve is just straight-up dumb. I'll give this game a 5/10, but I'm gonna put this as not recommended. There's too many issues that can only be overlooked under a cheaper pricetag. P.S. I wrote this when I was worse at the game, and thus this made my review a tad more negative. The difficulties above All-Star are pretty ridiculous, but All-Star is relatively reasonable and not overly arduous after playing for a while. This game truly is a grind, it's unpolished, but it's very fun, and basically a necessity if you are a big NBA fan. Once again however, ONLY buy it on sale. TLDR; Buy on sale. Game is a massive grindfest, really unpolished, and flawed in so many ways, but it can be incredibly fun. If you're a big NBA fan, and the game is on sale, I wouldn t question buying it. ",0,0
this game is terrible once it seemed interesting to me but it's been about 4-5 years in beta and alpha version .... I'll spawn at random in the middle of the desert and maybe half an hour I'm looking for a city I happen to come across but still all the houses are locked so it's is completely useless ... ,0,1
"So, having played over 500 hours of CSGO, I can finally speak out about this game. At the time of its release, CSGO was a pretty good game, but with each update and as its audience grew, it got worse and worse. At the moment, the game is bad in every sense and is more of a tool for making money than a game. Now I will explain why I think so. I want to name the main problems of this game. First and foremost is cheating. Of course, cheating is a problem in almost all multiplayer projects, especially in the shooter genre, but in other games it has not reached the same scale as in CSGO. And the developers do not want to fight this in any way. Yes, they release some updates to the anti-cheat system, he introduced this `` patrol '' and the reporting system, but in my opinion all their attempts look like a confused woman putting a leaky condom on her clients, forgive me for such a rude comparison. Second and not less important is the extremely small number of updates that bring something new to the gameplay of the game. Basically, updates add new cases with skins, new operations with paid passes, sometimes, of course, updates are released that allow you to customize the game I'm talking about new weapons, gloves, graffiti. But they do not fundamentally bring anything new to this game. And I think we all understand why these updates are being made. The third problem with this game is its blessing and curse at the same time. Her popularity. So I'm trying to get you to talk about the community in this game. Namely, the rabble that you will come across in the main. I do not argue that there are enough inadequacies everywhere, and okay, so be it, if they did not interfere with their behavior to others. This I am now talking about those people who like to be kicked out of the game for nothing, or because his opinion did not agree with yours or your actions in the game seemed to him wrong and he probably would have done better. About those people who, when your team is defeated, instead of trying to do at least something to win, they try in every possible way to spoil the game for other players in the team who already have a hard time. About those people who think it's funny to include music in the voice chat or shout any heresy. I am about those people who believe that they all owe them and for any attempt to object to them in your address, you will only receive a ton of insults. And yes, you can try to expel them from the game, but basically these personalities are not played alone and thus they become immune to any attempts to expel them from the game. And there are a majority of such people here, there are certainly adequate people who try to somehow play as a team to do something to win, communicate more or less politely, but there are very few such people and you will rarely come across them. All this can be avoided only if you play with a team made up of your friends and acquaintances. It seems that all I wanted to tell you about this game. I highly do not recommend buying this game. Don't waste your time, money and nerves. 1/10 P.S Forgive me grammar nazi if I made some mistakes in the text. ",0,0
"Im a little bit disappointed with how buggy the game is even in the early access. I didn't expect Larian studios to release a 59.99 euro title game so unfinished for the price. I would much rather wait till next year and have the game somewhat polished and ready to be played with no issues. I found the game in its current state somewhat more of a comic, because of visual glitches, rendering issues, desync and some actions dont function at all. Not to mention my friend i played with had crashes occuring under 2 hours into the game. At this current stage i can in no way recommend it. Unless you understand the problems you might encounter and dont care about your character t-posing during cutscenes. Bonus:    A more accurate scenario of what can happend in most cinematics ^^ ",0,1
Game feels cheap ,0,1
The ending did not satisfy me. Upset ( ,0,0
"⁣Terrible game, the guy who didnt put a bench in the  room before the final boss of the Godhome is a brai**dead re**ard , how can you be such an idiot, this game is a just an overrated piece of art, sure the game looks good but the boss fights are so bad omg they are so freaking bad especially Soul Tyrant and Nightmare Grimm both of those are almost never on your screen so you cant damage them so guess what you spend 10 mins fighting them its the most boring thing that ive ever done in my life , the Oro brothers have more health than every single boss in the game combined so if your nail isnt at max level than good luck beating those 2 fat bastards , seriosly arent they supposed to be honourable warriors ? then why is the fight 1v2 wtf wtf im loosing my mind, im loosing my braincells every time that i play this trash  ,put a healthbar for the boss fights for ♥♥♥♥ sake. My brain is melting I cant anymore im done ",0,0
FUCK ,0,1
Pubg is a dead bug full of shit game. I don't even have a star. Shit game ,0,0
the worst graphics on ultra just dont buy ,0,0
for daube ,0,0
Horse zalupa. I do not advise ,0,1
"Despite my love for wolves, I could not fall in love with this game and it lasted me no more than 10 minutes. During these 10 minutes I realized what a trash it is. I could not figure out how to beat animals, although I poked all the keys. A bunch of do not understand why the panels are needed, the benefit of the disconnected ones. The game itself is inhibitory, although the idea is gorgeous, but the embodiment ... for such an embodiment you can only spank in the ass. It is especially awful to turn the camera around, this is the slowest thing here, although it may be even worse, but I did not look for it. The change of day and night pleased, the sounds of the forest are also good. All sorts of buns are scattered throughout the forest for which they apparently give achievements inside the game, such as cans of Coca-Cola, although what they do in the forest, and even neatly placed and closed, is not clear. In general, I do not recommend it as a game, in general. For collection, if you are a real lover of animals - yes. Otherwise, no. Not even for the sake of cards. And there are no achievements in it. ",0,0
"Hell games collision ve then why do you not getting even with me snap out real well- matched pups manage Blue Hole fucked fly ; Oh, I crashed a few times this week, but I'm going to fix this. I don't keep making this new map. Someone is not a Hell Shipbuilding company. I'm looking for new ones. Dirty really ",0,0
"You must have a strong computer for this game, otherwise it will not enter. ",0,0
"Don't understand how people are saying this is an amazing VR experience lol. It's extremely short and the only time you get to do something is when you press like 5 buttons or wave your lightsaber around for about a minute to deflect some shots, the rest is basically a 360 cutscene. When it ended I honestly chuckled because I thought there would be more to it, very dissapointing even for a free experience. ",0,0
the game is not worth not spears bullshit ,0,0
I enjoyed this game better when it was downloading. ,0,0
game actually sucks now ,0,0
"I dont know why but it always crashes when i press on 'continue' after installing the game, just image i dont get my 70€ back, that would be so frustrating ",0,0
"because of the optimization curve, there is no desire to pass, and when I bought I did not think that everything was so bad ",0,0
"The game is good, but only if you play with friends or on servers with the British. The ru community is worse than shit ",0,0
it sucks... ,0,0
Paradox has never made and will never make a good video game. ,0,0
"short, no story, boring ending ",0,0
"Did not like. The tooltips are terrible, the radius of the objects is larger than the sprite, so the brush is reset, the achievements are weird. I completed all 100 levels - it was the worst thing I have done in the last month. I do not recommend buying. ",0,0
dlc is also shining! ,0,0
