İ ,1,0
"Before I played Among Us, I had a small pp, no friends, no gf, depression, and no life. These things haven't changed, but the game is pretty good Award me pls <3 ⢀⡴⠑⡄⠀⠀⠀⠀⠀⠀⠀⣀⣀⣤⣤⣤⣀⡀⠀⠀⠀⠀⠀⠀⠀⠀⠀⠀⠀⠀ ⠸⡇⠀⠿⡀⠀⠀⠀⣀⡴⢿⣿⣿⣿⣿⣿⣿⣿⣷⣦⡀⠀⠀⠀⠀⠀⠀⠀⠀⠀ ⠀⠀⠀⠀⠑⢄⣠⠾⠁⣀⣄⡈⠙⣿⣿⣿⣿⣿⣿⣿⣿⣆⠀⠀⠀⠀⠀⠀⠀⠀ ⠀⠀⠀⠀⢀⡀⠁⠀⠀⠈⠙⠛⠂⠈⣿⣿⣿⣿⣿⠿⡿⢿⣆⠀⠀⠀⠀⠀⠀⠀ ⠀⠀⠀⢀⡾⣁⣀⠀⠴⠂⠙⣗⡀⠀⢻⣿⣿⠭⢤⣴⣦⣤⣹⠀⠀⠀⢀⢴⣶⣆ ⠀⠀⢀⣾⣿⣿⣿⣷⣮⣽⣾⣿⣥⣴⣿⣿⡿⢂⠔⢚⡿⢿⣿⣦⣴⣾⠁⠸⣼⡿ ⠀⢀⡞⠁⠙⠻⠿⠟⠉⠀⠛⢹⣿⣿⣿⣿⣿⣌⢤⣼⣿⣾⣿⡟⠉⠀⠀⠀⠀⠀ ⠀⣾⣷⣶⠇⠀⠀⣤⣄⣀⡀⠈⠻⣿⣿⣿⣿⣿⣿⣿⣿⣿⣿⡇⠀⠀⠀⠀⠀⠀ ⠀⠉⠈⠉⠀⠀⢦⡈⢻⣿⣿⣿⣶⣶⣶⣶⣤⣽⡹⣿⣿⣿⣿⡇⠀⠀⠀⠀⠀⠀ ⠀⠀⠀⠀⠀⠀⠀⠉⠲⣽⡻⢿⣿⣿⣿⣿⣿⣿⣷⣜⣿⣿⣿⡇⠀⠀⠀⠀⠀⠀ ⠀⠀⠀⠀⠀⠀⠀⠀⢸⣿⣿⣷⣶⣮⣭⣽⣿⣿⣿⣿⣿⣿⣿⠀⠀⠀⠀⠀⠀⠀ ⠀⠀⠀⠀⠀⠀⣀⣀⣈⣿⣿⣿⣿⣿⣿⣿⣿⣿⣿⣿⣿⣿⠇⠀⠀⠀⠀⠀⠀⠀ ⠀⠀⠀⠀⠀⠀⢿⣿⣿⣿⣿⣿⣿⣿⣿⣿⣿⣿⣿⣿⣿⠃⠀⠀⠀⠀⠀⠀⠀⠀ ⠀⠀⠀⠀⠀⠀⠀⠹⣿⣿⣿⣿⣿⣿⣿⣿⣿⣿⡿⠟⠁⠀⠀⠀⠀⠀⠀⠀⠀⠀ ⠀⠀⠀⠀⠀⠀⠀⠀⠀⠉⠛⠻⠿⠿⠿⠿⠛⠉ ",1,0
toooooooooooooooop ,1,0
"I just started the game for a few hours, I have been playing the game for a few hours. ",1,0
I recommend this game to everyone ,1,0
"As time pass, Square enix seems like cant improve a lot in those games Game graphically better than previous ones like is supposed to be The new rappel was a good improvement, and some new finishers too but thats all Btw square enix wheres is compound bow? ",1,0
Combine the card with +1 and lose it at the end ,1,0
To play with friends I highly recommend it !!! ,1,0
gay ,1,0
Really good game with lots of potential. Teamwork is everything in this game. 10/10 ,1,0
it's crazy ,1,0
Cyberpunk is cool! The game is worth the money. ,1,0
"Norm game, you can get scared ",1,0
"It exists, it's free and I played it in early access, but if I remember correctly it was fun. Just an attachment-free shooter. -No achievements -They added skins -No progression, you just spawn and destroy noobs ",1,0
"Don't be fooled by the deadline. I play the game ps vitada and am almost halfway. I played the game for 24 hours. Trails in Sky is actually a trilogy. This game is called ""first chapter"" shortly as ""fc"". Then, after the second chapter, the third chapter comes. Even if I don't know wrong, there is a save transfer event. Isn't it interesting? A jrpg and save export. You can also deduce that you have to play this series in turn. There is only a situation like this. The ""trails"" series does not end when the 3rd chapter ends. The trails in sky trilogy ends. It still has Cold Steel Azure & Zeros. Therefore, if you are going to start the series, I suggest you go in the following order. I will do that. FC -> SC -> 3rd -> Zero -> Azure -> CSI -> CSII -> CSIII -> CSIV CS by Cold Steel. Let's get to the game after giving this information. Trails in Sky is a classic turn-based jrpg that debuted in 2004. The order advancing from top to bottom on the left of the screen shows who has the attack order. It happens that he sometimes writes critical, ep 50%, cp 10% besides the person or enemy whose turn it is. These are simply bonuses. There is no random encounter in the game. Even this is a plus in itself. Our main character Estelle receives a surprising gift from her father at the beginning of the game. Of course, what kind of gift is this for his father? Estelle also wants to be ""Bracer"". Bracer money problem solver. We can say that it is a kind of mercenary. In order to be a bracer, it is necessary to pass written practical exams at various stages. The game does not force you in this regard. It doesn't even force it at all. After a little mission, you get bracer. He progresses more on this in the game. You can take various missions from bulletin boards in bracer guilds or go directly to the main scenario. My advice is to do these tasks as much as possible. Small missions, mostly guild missions, such as killing creatures, escorting or finding something lost. Of course, not all of them are like that. They have different missions among them. You may think, ""I will move forward in the main scenario, and do these tasks towards the end of the game"". Unfortunately, the game does not offer you such an opportunity. These are the missions that are canceled after a certain stage. You may go to the bulletin board and see an expired text next to an advertisement that you have never seen. If you want to avoid money problems, you should do these tasks. Do not worry, there are not many of these tasks. In the prologue part, there were 8 or 10 or so. I stated above that the game is turn-based. What you need to be careful about here is to hit the enemy as unnoticed as possible. Thus, you will both earn the right to hit the first hit and get double exp bonus. The opposite can be really troublesome sometimes. Based on the amount of time I've played so far, I can say that you shouldn't spend too much time with enemies. Just fight once to add to the monster notebook if you encounter a new enemy, and when you look at the enemy by saying details during the fight? analyze if any. We can compare the system of the game to the Material system of Final Fantasy 7. Similar logic but slightly different and more detailed. Already the game gives a tutorial about it. The system works as follows; As you kill the enemy, various orbs fall from these enemies. You go to the shops called Orbal Factory and open slots thanks to these orbs and you throw various skills there such as attack 2, hp 1 etc. Or, using these orbs, you can create skills such as defense 1, hp 2, and then assign them to the slots you open. You can also monetize these orbs if you want, but I wouldn't recommend. Don't do it unless you're stuck with a lot of money. To talk about the characters, our main character Estelle Bright is a tsundere. He approaches events more emotionally than logical. Her half-brother Joshua is the opposite of Estelle. But I have to point out that it's about Joshua. Estelle's father and Joshuan don't have any blood ties. (If the game reverses about this in the future, it is a separate issue, which is not mentioned in the review) Speaking of Estelle's father, it would not be if we don't mention him. Caius Bright. Living legend in the game. You will hear a lot of different characters in the game that are very powerful, incredibly talented, literally the definition of perfection. Even our teacher in the Bracer guild is a student of Caius. Almost every character in the game has a personality. Some people like to fish, some are watching the stars and dreaming at night, others try to get what they want by using their position, etc. etc. So talk to anyone you can talk to. They can also give you good tips. At the beginning of the review, I mentioned that I played the game vitada. The reason for this is entirely due to the voiceover. And the voiceover is really good. Let me give you good news, they have adapted it to PC. With a little research, you can find it. I have to mention that I haven't tried it. For the part I've played so far, my score to the game is 87. I guess that it will get a close score when the game is over, looking at the course of the game. ",1,0
cute ,1,0
Excellent game ,1,0
Very good ,1,0
good ,1,0
Great game ,1,0
This is definitely one of the best games I have ever played! ,1,0
"Fun moba game, the best i've seen so far. :3 ",1,0
"100% worth it for the price, it's a fun simple and well done game where you time your movements to jump from one side of the screen to the other, dodging a bunch of different shapes. There are also four power-ups to collect, and the saw is the best one by far. If you like simple addicting arcadey-style games, then pick this up! Also, apparently i'm the 32nd best Ding Dong XL player in the world, which is the highest I've ever been ranked in something like this. So that's cool ",1,0
Existential crisis in video game form. ,1,0
Good strategy game for iso ,1,0
"Mom dear! Sege 60! What are you going to do ?! [it’s okay: their first game - Periscope 1965] Streets Of Kamurocho is a publisher's anniversary, scanty, almost complete copy of the first level of Streets of Rage 2 with characters from the Yakuza series [2 are initially playable and one is unlocked after passing ] Minus: - Just a little - You can't play together with one keyboard - There are no retro filters - Yakuza [for my taste - unknown perverse nipon crap] Plus: - Streets of Rage 2 (divine) Personally, I got a portion of nostalgic emotions indecently small, not even it was clear whether it was worth it ... ",1,0
wish i had more time to play it ,1,0
Good game ,1,1
Excellent Game !! Got it on uplay and now on steam I wish I could transfer my save data from uplay .. but it doesn't work ,1,0
Let's change the toy <3 ,1,0
"NOTICE FOR THE HESITANT ----------------------------------------- Hi, time at which I write this evaluation I must have around 8 hours of play so I'm a ""noob"" you must have come across notices warning you about the difficulty of the game, ♥♥♥♥♥♥♥♥: the The game is great, I connect to French servers where there are only adorable French people who are happy to guide us, squads are sometimes created or several beginners share their knowledge! and each game we learn something! and just this realistic war atmosphere plunges us into a great mood. BEWARE: if you want to kill and blablaba go your way, however if you want to immerse yourself in a simulation of war pushed to the extreme, go for it! (obviously you will still kill :)) short here is the conclusion: scroll up and buy ",1,1
"I really liked the game, I don't play other battlefields because I don't have a PC for that. ",1,0
nice game. game like game. ,1,0
Top game ,1,0
"In recent years Sega has been lacking a bit with its pet games, but this is one of the best that exists, it brings together the best of the new mechanics with the old ones that we all know, and it does it in a sublime way, and now you They are GIVING it away by putting it at a 95% discount (about 11 Argentine pesos that would be 16 cents on a dollar) I recommend them to everyone, whether you are an old player of the saga or even to get started, great game. ",1,0
"The latest update is something with something, just a class. Many bugs were fixed, now it is more pleasant to play ",1,0
8/10 ,1,1
Just loving the game ,1,0
This game is so awesome! ,1,0
Killer are so fun but they are to good some times ,1,0
A great game ,1,0
"Gameplay is fun and low specs, the cash system is complex as hell though. But to be fair, you do not have to spend any cash on the micro transactions. ",1,0
1 ,1,0
"There's a good story in this game, my favorite points were once we threw a pear on a fucking hard wall (Juuso threw it and it goes to the gym) I ordered a burger. After that, I went home and watched the news from the mound. The highlight of the story was at the end when my child was dying so I decided to shit on my dad’s back. ",1,0
its ok i guess ,1,0
Very Enjoyable to play while having the slight aspect of danger ,1,1
"Guys, I've been playing csgo for 2-3 years. Csgo is a very nice game yes it may contain some violence but it contains a little bit and the game is beyond perfect. Yes the patterns can be a bit expensive but I bought a lot of designs in csgo ",1,0
"Despite this not being the best port, it's still extremely fun If we could recieve some updates with more possibilities for configurations and even online play, this would be pretty cool and would change the game a lot for the better. It's extremely fun to play with somebody, and if you have somebody to play with, this is a good deal. ",1,0
"It is gratifying to find pearls where I did not expect too much; I want to pay tribute to the novel, it coped with its task remarkably - pleasantly while away a cool winter evening for me. It should be added that the Christmas mood contributes a lot to the goals described; while all this atmosphere still hovers in the air, there is a Christmas tree, garlands in the room, you finish the remnants of salads from the 31st and eat them with new ones, cut for mom's birthday. A very touching, unhurried story about the misadventures of a twelve-year-old girl, Ethany; difficulty of choice: me or family, my life or the life of other people, struggle or humility. I liked all the endings without exception, every time it was a little different from what I expected from the very beginning - and this is wonderful. There are absolutely adult thoughts, there is a childish, naive belief that tomorrow will definitely be better, there is a funny humor spiced with characteristic chibi-art. The aftertaste from the passage remains sweetish; It’s like I’ve read a little story, with an open ending - but here you can decide on your own how open it will be (and whether it will be at all, or it will all end without really starting). Laura grains, and it's a pity, the story with the Lighthouses and Rangers has great potential, and surely in this world many more plots could be thought up - but we are already shown several views of everything that happens, and the characters are mostly curious, behind a rare (and subjective ) exception. Being able to perceive miracles and having an interest in the concept of appropriate sacrifice - no doubt; you have to dive, but not very deep. ",1,0
"""The Book of Unwritten Tales: Die Vieh Chroniken"" is a classic point & click adventure and tells the story. Here you will get to know two characters you already know from the first game. The adventurer Nathaniel ""Nate"" Bonnet and the mysterious cattle. Nate is on the run again from the bounty hunter Ma'Zaz. This time the cat & mouse game takes you to the icy northern lands and to Seefels. Some strange characters will cross your path again. You control up to two characters alternately and apart from the space bar you only need the mouse for help. Visually, the game lags a bit behind the first, even if the last third shows a lot. The puzzles are partly (too) crisp and there are again many funny allusions to all sorts of familiar things. The German voice output is first class, I found the background sound to be very pleasant. Main story: 7-10h replay value due to two different levels of difficulty (normal & difficult). Difficult makes the puzzles even more ""tough"". Apart from the achievements, there is no optional content or microtransactions. Too much room for swipes at the PETA organization. Funny in the beginning, annoying over time. This part felt a lot less charm and variety than the first game and I had to laugh a lot less often. Some of the puzzles were too much trial & error for me. It gave me too few hints, even on the normal level of difficulty, which sometimes did not motivate me to continue playing. A fun puzzle adventure with weird characters, a little too much trial & error and too little variety. ►► ►► ⸻⸻ The game was played in a resolution of 5120 x 2880 (DSR) on the following system: ⸻⸻ 👑 Powered by HoI 4 Deu curator group in German / English 👑 ⠀⠀⠀ and discover more reviews from me 🎊 Cheers, Fletcher ",1,0
your ,1,0
Who wanted minus nerves? ,1,0
Fun to play with friends :D ,1,0
"Really crude! That was the game so far, where I still shudder a lot, even if I've played it through 2-3 times! The realistic graphics, the realistic shadow play, the ambient sound and the ""zombies"" make the game a UNIQUE EXPERIENCE! You always have the feeling that you are really part of it, which really scares me in a horror game like this one! But the money is really worth it! :) ",1,0
"An excellent game, where, in addition to dancing to the music, we can test the dexterity of our fingers in pressing the keys =) What pleased us was the online mode, where you can arrange a dance battle with other players! The game will definitely hook you! ",1,0
"Unfortunately, I'm not familiar with the original comic, so I can't say how exactly the characters of the game correspond to the original source. But what can I assure you - Blacksad: Under the Skin really Murders, scandals, intrigues, excuses - here you will find everything you need for a fascinating story. Moreover, the player is not a simple observer of developments. You will have to look for evidence yourself, find a connection between them and draw the appropriate conclusions. The game has a special screen, which is somewhat reminiscent of the ""web of evidence"" from Sherlock Holmes. In this mode, you will compare the facts and calculate the suspects. And even if you do not understand or miss something, the hero of the game, the cat Blacksad, carefully writes down all the observations and conclusions in a notebook, which can always be opened and guessed at one time or another. Therefore, you will never lose the thread of investigation, as is often the case in film detectives. The only thing that can overshadow the impression of the game adaptation of Blacksad - a weak technical side. Some scenes have a horrible frame rate, the character interacts clumsily with the walls, so walking in narrow places turns into a stream of curses, sometimes a black screen appears after loading, and so on. However, the dynamics of the plot almost smooths out all the shortcomings. More than once you will be sure that you have found the killer, but thanks to his keen eyesight, sense of smell and hearing, Blackhead will always throw in new evidence and the chase for the real criminal will continue! If you like detective stories - take Blacksad: Under the Skin without thinking. ",1,0
Good GTA style game only in school version! The only negative is the control! ,1,0
"After perhaps not as many hours as many others, I can say that from the beginning it was a very fun game that causes tension like few others, as much as if you prefer stealth or go crazy either with your team or alone against 100 people is very satisfying, before I would not have recommended this game so much because of its poor optimization, but now it is extremely good to play in comparison and it looks simply spectacular, one of the surprises of 2017 that undoubtedly won the hearts and pans of many players. ",1,0
"It is night when Yaya Haku, an old Qüido (I would say they are jellyfish people), is out in her boat and a ship explodes very close to her. She heads for the burning wreck and finds a basket with a baby in the rubble. The little koa. Since nobody else has survived this misfortune, Yaya takes the girl to her island and raises her. But time moves on relentlessly and things change ... At this point I would like to point out that you can play the prologue of the game as a demo. It includes the beginning and tutorial described above and gives a good first impression of the game's gameplay. You can find the link to the demo below in my conclusion. Chibig, developer and publisher, is already known to me through mobile games and has already shown at Deiland, to which I unfortunately cannot link a review, that a mobile game can also be ported and adapted well to the PC. Summer in Mara is a beautifully viewable single player title. You slip into the role of Koa, the little girl that Yaya Haku fished out of the sea, and head for an adventure. The island of Yaya wants to be cultivated; Felled trees are replaced by newly planted seeds, fruits are harvested and fields are tilled. You can also go fishing and mine ore on the island. Of course you can do some of the activities on other islands; yes, you can set sail too. The ability to go out to sea you unlock in the course of the story. This enables you to travel to new islands, meet new people and also find new components to build. You can also learn new recipes and improve your equipment. With what you cook in your home, most of all, you regain endurance and fill your stomach. But what happens when you are starving, I haven't found out yet, I've always fed Koa nicely. In order to cook, you need, of course, ingredients that you can either grow, harvest in the wild or buy from vendors. You can also make multiple items in your kitchen at once, as long as you have the necessary ingredients. But your home is not only used for cooking, you also have a workshop and can build certain things outside of your own four walls. For example, a new well next to your fields, so you can not only irrigate your fields and shorten the ripening time, but also increase the limit of the tree population on your island. And you will need the space, either because you need a lot of wood or because you bring a lot of new fruits from your travels and want to plant them on your island. The last important function of your home is sleeping. You can also spend the night on your boat, but that doesn't bring back as much stamina as a night in your own bed, not rocked by the sea. Unfortunately the characters are not synchronized, only an occasional ""Ah!"" or something like that, sometimes laughing too. Otherwise, the game is accompanied by good background music that accompanies you in the game. Islands and characters are pretty, colorful and individually designed. In the conversations, the drawn portraits of the characters are displayed and also change facial expressions according to the situation. Summer in Mara is a nice title. If you want a relaxed adventure with farm elements, I don't think anything wrong here. The best thing to do is to download it and take a look at Koa's world for yourself. This product was made available by the developer / publisher for review purposes. ",1,0
NICE GAME ,1,0
:) ,1,0
ssss ,1,0
:) ,1,0
"This is a real, good horror movie, not some Outlast (which of course is also good) where you just run and hide. tl: dr Better than Outlast. ",1,0
"Great game! Even if it's five years old, it's still fun and the servers are still comparatively full! Absolute purchase acceptance :) ",1,0
"fantasy fps game ever , a variety of weapons,each weapons have its own asset and special effects when using, do not hesitate specifically on clearance ",1,0
"Highly recommended if you like Digimon, as a MMORPG and as a Digimon game there are better options, but the online experience it offers you is unique and you will not find it in another game in the franchise. ",1,0
"The name is very apt. There are lo fi chill beats to write to, and you can write kind words. Aside from collecting the decorations, there's not really a game here, rather a beautiful idea, makes you all warm inside. While the purpose is helping and spreading positivity, you can end up feeling a bit down hearing everyone's problems, so tap the paper planes as well for small doses of happy. Good music, cute aesthetic, heartwarming concept. ",1,0
"If you don’t want to be the King of Salaries, you are going to be the King of Renᖗ( ᐛ )ᖘ ",1,0
I like ducks whoever likes it ,1,1
cool ,1,0
"David aka ""Dave"" is very suck ",1,0
"I will say from myself - ""I am delighted with the game!"" Amazing graphics, thanks to Cryengine! Excellent optimization, all crybabies with buckets of bolts - go forest! Buy a 1080 Ti, a normal gaming computer for £ 200,000. and then we'll see how you complain about the optimization !!! And then they sit on ancient computers and yapping, ugh at you, abomination. So, and now on the case, when all the scum that was all over the place. Beautiful setting, location and timing is perfect for this game. Interesting replayable gameplay, thanks to the permanent death of characters. Fortunately, the progress of the account remains monolithic. We introduced a system for pumping a character, talents, HP, gradually opening guns and attachments for your account and your fighter in particular. What Crytek has always been famous for is its attention to detail! These are the most beautiful zombies since L4D2! Thanks guys, the eye is not happy! I've been waiting for this game for over 4 years. I waited and took part in the alpha test. To the screech of a pig, he rejoiced at every victory. The shooting system has a bias towards realism, except that there is no ballistics, as in BF3. And so, a fairly high entry threshold. Play solo and party with a friend. In a sense, PvE & PvP. There are many options for passing the mission, the game forces you to be flexible if you want to win. The best zombie hunting simulator of recent years! The game is worth its money to the penny. They asked a little more, the game will expand, there will be about 15 bosses. As for the map, I won't say for sure, I don't know if there will be other maps. I bought it as soon as I received a notification by email, Hunt is available on Steam! In conclusion, I want to say, thanks to everyone who worked on this game! Good luck and success in the future, we are with you! I invite you guys to plunge into the world of treacherous hunters, disgusting creatures and damned swamps of Louisiana ... ",1,1
